key	title	source_url	decision_details	date_str	decision_num
2025-01-20-003-f26f	Relocation of the unauthorized dwellers in the Kelani Valley Railway Reservation	https://www.cabinetoffice.gov.lk/cab/index.php?option=com_content&view=article&id=16&Itemid=49&lang=en&dID=12992	- The Cabinet, at its meeting held on 2024‑08‑05, has granted approval to relocate the unauthorized dwellers within the railway reservation from the Loco Junction, Maligawatta to Padukka Railway Station under the Railway Efficiency Improvement Project, having provided them with housing or compensation. Accordingly, the settlement in 694 houses purchased from housing complexes owned by the Urban Development Authority has already been completed and another 144 housing units are due to be received from the Urban Development Authority. A housing complex with 120 housing units is being constructed in a land owned by the Railway Department in Malapalla, Kottawa for the re-settlement of unauthorized dwellers in Maharagama, Homagama and Padukka areas where no housing scheme of the Urban Development Authority is available and their construction is nearing completion as of now. As such, the proposal made by the Minister of Transport, Highways, Ports and Civil Aviation to vest the land located at Malapalla, Kottawa owned by the Department of Sri Lanka Railways, together with the housing complex standing thereon, with the National Housing Development Authority as a free grant as per the provisions of section 6(1) of the State Land Ordinance, enabling to grant deeds to the beneficiaries to be settled in the said housing complex and to implement the programme for providing the relevant deeds to the selected beneficiaries without being a burden to them, was approved by the Cabinet.	2025-01-20	3
2025-01-20-002-1dcc	Bilateral Air Services Agreement between the Government of Sri Lanka and the Government of Italy	https://www.cabinetoffice.gov.lk/cab/index.php?option=com_content&view=article&id=16&Itemid=49&lang=en&dID=12991	- Negotiations have been conducted between the Government of Sri Lanka and the Government of Italy on measures related to bilateral air services between the two countries, and accordingly, Cabinet approval has been granted on 2018‑07‑24 to sign an Air Services Agreement between the two countries. However, the said Agreement has not yet been signed and both parties have recognized the desirability of entering into the said Agreement expeditiously. Under the proposed Agreement, it will be possible to operate up to 14 scheduled flights per week for air passenger services and up to 07 scheduled flights per week for air cargo services on the agreed routes using any type of aircraft. Accordingly, the proposal made by the Minister of Transport, Highways, Ports and Civil Aviation to sign the said Air Services Agreement between the Government of Sri Lanka and the Government of Italy, was approved by the Cabinet.	2025-01-20	2
2025-01-20-001-f6b4	Establishment of the Faculty of Medicine of the University of Moratuwa	https://www.cabinetoffice.gov.lk/cab/index.php?option=com_content&view=article&id=16&Itemid=49&lang=en&dID=12990	- The first batch of medical students of the Faculty of Medicine at the University of Moratuwa, enrolled based on the 2019 G.C.E. (Advanced Level) results, is scheduled to commence hospital-based clinical training in July 2025. The Cabinet had granted approval previously for the establishment of the Faculty of Medicine at the University of Moratuwa using the existing facilities at the premises of South Asian Institute of Technology and Medicine (SAITM) and the use of the facilities of the Dr. Neville Fernando Hospital for hospital-based training of medical students. However, it has been observed that using Dr. Neville Fernando Hospital for clinical professorial training of medical students of the University of Moratuwa is problematic, due to the insufficient number of patients receiving treatment at the said hospital and the diversity of their diseases, and the shortage of hospital staff and specialist doctors. Therefore, the joint proposal made by the Hon. Prime Minister in her capacity as the Minister of Education, Higher Education and Vocational Education; and the Minister of Transport, Highways, Ports and Civil Aviation, to utilize the Kalutara Teaching Hospital and the Gallassa Maternity and Children's Hospital to ensure that a quality hospital-based training is provided to the said medical students, and to vest 02 plots of land belonging to the Sri Lanka Transport Board and the Road Development Authority in the Nagoda West Grama Niladhari Division of the Kalutara Divisional Secretariat Division, with the said University for the establishment of the Faculty of Medicine of the University of Moratuwa, was approved by the Cabinet.	2025-01-20	1
2025-01-06-017-58d0	Granting the Stationery Allowance to the children in families that do not receive the Aswesuma but meet the other qualifications, under the Programme for Providing Stationery to School Children.	https://www.cabinetoffice.gov.lk/cab/index.php?option=com_content&view=article&id=16&Itemid=49&lang=en&dID=12989	- Measures have been taken by now to grant the allowance of Rs.6000/- each for purchasing stationery for school children in Aswesuma beneficiary families, through the bank accounts of the said families. Providing the said allowance to children who have lost their parents and not belonging to Aswesuma beneficiary families, children from families with a disabled mother or father, all children of school age in orphanages and children belonging to the categories of destitution due to special reasons, have been entrusted with the Ministry of Education, Higher Education and Vocational Education. The Cabinet, taking into account the non-availability of an updated database as of now, to select children from families belonging to aforesaid categories, and the need to provide the proposed Stationary Allowance at the beginning of the new school term in 2025, approved the proposal made by the Hon. Prime Minister in her capacity as the Minister of Education, Higher Education and Vocational Education to grant the Stationery Allowance of Rs.6,000/- each, to all children from families that are not beneficiaries of Aswesuma in 6,576 schools with less than 300 children out of the total of 10,096 schools across the Island, children coming to schools from Child Development Centres and lay and monastic students in Pirivena and provide the said allowance through a voucher.	2025-01-06	17
2025-01-06-016-1492	Signing of Memoranda of Understanding/Cooperation Agreement between the Ministry of Health and Mass Media and the Institutions of the People's Republic of China	https://www.cabinetoffice.gov.lk/cab/index.php?option=com_content&view=article&id=16&Itemid=49&lang=en&dID=12988	"- The proposals made by the Minister of Health and Mass Media to enter into Agreements with the following institutions of the Ministry of Health and Mass Media and the People's Republic of China with the objective of strengthening the cooperation between the two countries, were approved by the Cabinet.
(i) The Memorandum of Understanding (MoU) between the Ministry of Health and Mass Media and the National Radio and Television Administration of the People’s Republic of China.
(ii) The Memorandum of Understanding between Associated Newspapers of Ceylon Limited and the Xinhua News Agency of China.
(iii) The Cooperation Agreement between the Department of Government Information and the Xinhua News Agency of China.
(iv) The Memorandum of Understanding between the Sri Laka Rupavahini Corporation and the China Media Group.
(v) The Memorandum of Understanding between the Sri Lanka Broadcasting Corporation and the China Media Group."	2025-01-06	16
2025-01-06-015-729a	Signing of Certificate of Handover between Sri Lanka and China on Emergency Humanitarian Assistance Project to Sri Lanka (Rice, Fishing Nets and Housing Facilities)	https://www.cabinetoffice.gov.lk/cab/index.php?option=com_content&view=article&id=16&Itemid=49&lang=en&dID=12987	"- The People's Republic of China has provided the following emergency assistance to small-scale fishermen in the Northern and Eastern provinces of Sri Lanka at a cost of Yuan 35.7 million :
* 75,000 fishing nets for small-scale and low income earning fishermen.
* 500 prefabricated houses for small-scale and low income earning fishermen.
* 1,630 tons of rice for small-scale and low income earning fishermen
All these items were received by the Ministry of Fisheries, Aquatic and Ocean Resources in the year 2024, and the rice and fishing nets have now been distributed 	among the selected beneficiaries. Accordingly, the proposal made by the Minister of 	Fisheries, Aquatic and Ocean Resources to sign the Certificate of Handover of the said emergency assistance between the People's Republic of China and the 	Government of Sri Lanka, was approved by the Cabinet."	2025-01-06	15
2025-01-06-014-2a6c	Signing the Agreement related to the Protocol for Exporting Poultry Meat to the Chinese Market	https://www.cabinetoffice.gov.lk/cab/index.php?option=com_content&view=article&id=16&Itemid=49&lang=en&dID=12986	- It has been proposed to sign an Agreement between the Sri Lanka and China, including Inspection, Quarantine and Health Requirements, to be prepared regarding the procedures of the two countries to export poultry meat from Sri Lanka to China, with the intervention of the General Administration of Customs of China, under a specific procedure. Accordingly, the proposal made by the Minister of Agriculture, Livestock, Lands and Irrigation for signing the said Agreement between the General Administration of Customs of China and his Ministry, was approved by the Cabinet.	2025-01-06	14
2025-01-06-013-0431	Signing of a Memorandum of Understanding (MoU) between China Media Group (CMG) and Sri Lanka Tourism Promotion Bureau	https://www.cabinetoffice.gov.lk/cab/index.php?option=com_content&view=article&id=16&Itemid=49&lang=en&dID=12985	- It has been proposed to sign a Memorandum of Understanding between the China Media Group and the Sri Lanka Tourism Promotion Bureau with the objective of positioning Sri Lanka as a leading tourist destination for Chinese tourists by utilizing the modern technology and expertise of the China Media Group based on the cooperation developed between the two parties. Accordingly, the proposal made by the Minister of Foreign Affairs, Foreign Employment and Tourism to sign the said MoU, was approved by the Cabinet.	2025-01-06	13
2025-01-06-012-d56b	The Government of Sri Lanka continuing to follow the “One China Policy”	https://www.cabinetoffice.gov.lk/cab/index.php?option=com_content&view=article&id=16&Itemid=49&lang=en&dID=12984	"- The Government of Sri Lanka has continued to follow the ""One China Policy"", which means that it recognizes only the People's Republic of China as the legitimate China and Taiwan only as one province in China. It was decided to grant the concurrence of the Cabinet to the submissions made by the Minister of Foreign Affairs, Foreign Employment and Tourism that the Government of Sri Lanka will continue to follow and adhere to the said policy and act accordingly."	2025-01-06	12
2025-01-06-011-2fb6	Appointment of Mr. P.B. Terney Pradeep Kumara to the Post of Director General of the Department of Coast Conservation and Coastal Resources Management	https://www.cabinetoffice.gov.lk/cab/index.php?option=com_content&view=article&id=16&Itemid=49&lang=en&dID=12983	- A Senior Officer with theoretical and practical knowledge has to be appointed to the Post of Director General of the Department of Coast Conservation and Coastal Resources Management and Mr. P.B. Terney Pradeep Kumara, Professor in Oceanography and Marine Geology of the University of Ruhuna, has been identified as suitable for the said post. Accordingly, the proposal made by the Minister of Environment to appoint him to the Post of Director General of the Department of Coast Conservation and Coastal Resources Management for a period of two (02) years, was approved by the Cabinet.	2025-01-06	11
2025-01-06-010-631d	Appointment of the Commissioner and Assistant Commissioners of the Sri Lanka Inventors Commission	https://www.cabinetoffice.gov.lk/cab/index.php?option=com_content&view=article&id=16&Itemid=49&lang=en&dID=12982	- In terms of section 4(1) of the Sri Lanka Inventors Incentives Act, No.53 of 1979, the Sri Lanka Inventors Commission shall consist of a Commissioner and two Assistant Commissioners appointed by the Cabinet on the recommendation of the Minister. As all the members of the Sri Lanka Inventors Commission have resigned by now, a Commissioner and two Assistant Commissioners should be appointed to fill the vacancies. Accordingly, the proposal made by the Minister of Science and Technology to appoint Prof. Veranja Karunaratne as the Commissioner of the Sri Lanka Inventors Commission and to appoint Senior Prof. R.M.G. Rajapaksha and Dr. N.R.S.Ariyaratne as the Assistant Commissioners of the said Commission, was approved by the Cabinet.	2025-01-06	10
2025-01-06-009-c519	Appointment to the Post of District Secretary/Government Agent of the Administrative District of Trincomalee	https://www.cabinetoffice.gov.lk/cab/index.php?option=com_content&view=article&id=16&Itemid=49&lang=en&dID=12981	- The Post of District Secretary/Government Agent of Trincomalee has fallen vacant due to the appointment of Mr. Chaminda Hettiarachchi, who served as the District Secretary/Government Agent of the Administrative District of Trincomalee, to the post of Director General of the Department of Pensions with effect from 2025‑01‑01. The proposal made by the Minister of Public Administration, Provincial Councils and Local Government to appoint                        Mr. W.G.M. Hemantha Kumara, Special Grade Officer of the Sri Lanka Administrative Service, presently serving as the Additional Director General of the Department of Fisheries and Aquatic Resources, to the said post, was approved by the Cabinet.	2025-01-06	9
2025-01-06-008-ee3a	Amendment to the Criminal Procedure Act, No.15 of 1979	https://www.cabinetoffice.gov.lk/cab/index.php?option=com_content&view=article&id=16&Itemid=49&lang=en&dID=12980	- Approval of the Cabinet has been granted at its meeting held on 2023‑12‑05 to amend the Criminal Procedure Act, No. 15 of 1979 to provide for dispensing with the personal attendance of the suspect or accused in the Court under exceptional circumstances, recording remote testimony and service of summons via email to expert witnesses. Accordingly, the clearance of the Attorney General has been received for the relevant Bill drafted by the Legal Draftsman. The proposal made by the Minister of Justice and National Integration to publish the said Bill in the Government Gazette and to submit the same thereafter, to Parliament, was approved by the Cabinet.	2025-01-06	8
2025-01-06-007-5b54	Construction of New Anuradhapura - New Habarana 220 KV Transmission Line	https://www.cabinetoffice.gov.lk/cab/index.php?option=com_content&view=article&id=16&Itemid=49&lang=en&dID=12979	- International Competitive Bids have been invited to select a suitable contractor for the civil construction works, tower construction and cable work for the construction of the 45 km New Anuradhapura - New Habarana 220 KV Transmission Line under Package 4A of the Power System Reliability Strengthening Project. 02 bids have been submitted for the same. Accordingly, the proposal made by the Minister of Energy to award the relevant Contract to M/s Ceylex Engineering (Pvt.) Ltd., the lowest substantially responsive bidder, based on the recommendations of the Technical Evaluation Committee and the Standing Cabinet Appointed Procurement Committee, was approved by the Cabinet.	2025-01-06	7
2025-01-06-006-b399	Renovation and Conservation of “Richmond Castle” under Public-Private Partnership	https://www.cabinetoffice.gov.lk/cab/index.php?option=com_content&view=article&id=16&Itemid=49&lang=en&dID=12978	- The “Richmond Castle” premises and the Park Estate located in Palatota in the Kalutara District is a property owned by the Public Trustee's Department, and it is a historically and archaeologically valuable property that has gained local and foreign tourist attraction. The Archaeology Department of the University of Moratuwa and the National Building Research Organization have pointed out a number of essential repairs that need to be carried out in the said Castle. Accordingly, the proposal made by the Minister of Buddhasasana, Religious and Cultural Affairs to invite proposals from the interested investors in the private sector to carry out the renovation of the “Richmond Castle” and the maintenance of the said Castle under a Public-Private Partnership, without being contradictory to the intentions of the testator, was approved by the Cabinet.	2025-01-06	6
2025-01-06-005-df1e	Time Charter of two Harbour Tugs for the Sri lanka Ports Authority for operations at the Port of Colombo	https://www.cabinetoffice.gov.lk/cab/index.php?option=com_content&view=article&id=16&Itemid=49&lang=en&dID=12977	"- International competitive bids have been invited to procure a 80 Ton Bollard Pull Tug for the Sri Lanka Ports Authority, as per the Cabinet decision dated 2022‑10‑10. 04 bids have been received for the same and the Cabinet Appointed Procurement Committee has recommended to award the bid to the substantially responsive bidder. Meanwhile, owing to the Value Added Tax Act coming into effect from 2024‑01‑01, the procurement cost has increased upon the calculation of the tax value on the relevant procurement cost, and therefore discussions have been held with the recommended supplier to obtain the said tug on credit basis, but upon the expression of his inability, the said procurement process has been terminated. Subsequently, international competitive bids have been invited to obtain two 80 Ton Bollard Pull Tugs on time charter, and 03 bids have been received for the same. Although discussions have been held with the substantially responsive lowest evaluated bidder for the relevant procurement to obtain a price reduction in a manner that is beneficial to the Sri Lanka Ports Authority, no consent has been made to provide a significant price reduction by the said bidder. In the meantime, the management of the Sri Lanka Ports Authority has requested to cancel the above procurement process as the requirement for tugs needs to be reassessed, based on the progress of completion of the construction works of the new terminals at the Colombo Port. Accordingly, taking into account that the construction of the new terminals is scheduled to be completed between mid-2025 and the latter half of the year, Cabinet approved the proposal made by the Minister of Transport, Highways, Ports and Civil Aviation to pursue action as follows:
* To terminate the procurement process implemented by the Sri Lanka Ports Authority to take on time charter, two 80 Ton Bollard Pull Tugs for the operations carried out by the said Authority.
* To initiate new procurement activities to obtain two 70 Ton Bollard Pull Twin Azimuth Stern Drive Harbour Tugs on time charter for the new terminal operations scheduled to commence in mid-2025."	2025-01-06	5
2025-01-06-004-bac6	Payment of compensation pertaining to the loss of vision in several patients who has undergone eye surgeries at the Nuwara Eliya District General Hospital	https://www.cabinetoffice.gov.lk/cab/index.php?option=com_content&view=article&id=16&Itemid=49&lang=en&dID=12976	"- At the Cabinet meeting held on 2024‑02‑12, approval has been granted to appoint a Technical Committee to determine the amount of compensation to be paid to the victims who lost their vision in subsequent to eye surgeries, at the District General Hospital, Nuwara Eliya. Accordingly, a Committee headed by an Additional Secretary of the Ministry of Health has been appointed and the said Committee, having examined the same, has submitted its recommendations relating to the amount of compensation to be paid. Based on the said recommendations, the proposal made by the Minister of Health and Mass Media, to pay compensation for 17 patients affected by the said incident as follows, was approved by the Cabinet:
* Payment of compensation of Rs. 1,000,000/- each for 12 patients.
* Payment of compensation of Rs. 750,000/- each for 02 patients.
* Payment of a compensation of Rs. 700,000/- for one patient.
* Payment of compensation of Rs. 250,000/- each for 02 patients."	2025-01-06	4
2025-01-06-003-58e2	Handover of Papers discarded from the Government Institutions to the Valaichchenai Paper Mill owned by National Paper Company Limited	https://www.cabinetoffice.gov.lk/cab/index.php?option=com_content&view=article&id=16&Itemid=49&lang=en&dID=12975	"- The production activities of the Valaichchenai Paper Mill resumed in the year 2020, and the main raw material currently used for the production activities is waste paper. Continuous supply of waste paper stock has become essential to keep the production process going smoothly. It has been observed that the receipt of sufficient and continuous supply of raw materials could be ensured by providing the waste paper available in all Government Institutions to the Valaichchenai Paper Mill. Accordingly, the following proposals made by the Minister of Industry and Entrepreneurship Development to ensure a continuous supply of paper to the Valaichchenai Paper Mill, were approved by the Cabinet.* to hand over stocks of waste paper including high quality white paper discarded from the Government Press, State Printing Corporation, Election Commission, Ministry of Education and the Government Institutions functioning under the same, all Universities, all Ministries and Government Departments, to National Paper Company Limited free of charge, on the basis of providing transportation facilities by the National Paper Mill.
* to hand over all stocks of waste paper of other State Corporations, Boards and Statutory Institutions and all institutions affiliated to the Government, to National Paper Company Limited, deviating from the tender procedure, at a concessional price agreed upon by the relevant institutions and the said Company."	2025-01-06	3
2025-01-06-002-b6b3	Granting of incentives for the promotion of International Airports in the Country	https://www.cabinetoffice.gov.lk/cab/index.php?option=com_content&view=article&id=16&Itemid=49&lang=en&dID=12974	"- The Airport & Aviation Services (Sri Lanka) (Pvt.) Ltd. has introduced Concessionary Schemes for International Airlines with the aim of attracting International Airlines to Jaffna International Airport, Colombo International Airport (Ratmalana) and Mattala Rajapakse International Airport. Under this, the proposal made by the Minister of Transport, Highways, Ports and Civil Aviation to further extend the concessions provided for the Embarkation Levy for these Airports as follows, was approved by the Cabinet.
* Extension of the concession of 50% of the existing Embarkation Levy for the Airlines operating scheduled flights to Jaffna International Airport for another 01 year up to 2026-01-30.
* Extension of the concession of 50% of the existing Embarkation Levy for the Airlines operating scheduled flights to Colombo International Airport (Ratmalana) for a period of one year from 2025-03-27.
* Extension of the full concession of the existing Embarkation Levy for the 	Airlines operating scheduled flights to Mattala Rajapakse International Airport for another year from 2024‑12‑29."	2025-01-06	2
2025-01-06-001-a06e	Agreement on Co-operation and Mutual Assistance in Customs Matters between Sri Lanka and Vietnam	https://www.cabinetoffice.gov.lk/cab/index.php?option=com_content&view=article&id=16&Itemid=49&lang=en&dID=12973	- Although approval of the Cabinet had been granted at its meeting held on 2021‑11‑23 to sign an Agreement on Co-operation and Mutual Assistance in Customs Matters between Sri Lanka and Vietnam, the relevant Agreement has not yet been signed. The proposed Agreement is expected to achieve the objectives such as; reducing the cost of trade transactions between the two countries, accurate valuation and collection of taxes related to border taxes and imposing regulations on prohibition, restriction and control of the movement of restricted goods. The clearance of the Attorney General has been received for the Agreement, which has been agreed upon by both parties. Accordingly, the proposal made by the Hon. President in his capacity as the Minister of Finance, Planning and Economic Development, to sign the said Agreement between Sri Lanka and Vietnam, was approved by the Cabinet.	2025-01-06	1
